{
  "schemaVersion": 2,
  "reference": {
    "commit": "fd793696f50d3be0fcd3788f0f8f751c63869963",
    "routes": ["core", "colors", "layouts", "icons", "codeblock", "playground"]
  },
  "themes": [
    {
      "name": "light",
      "attribute": "light"
    },
    {
      "name": "dark",
      "attribute": "dark"
    }
  ],
  "viewports": [
    {
      "name": "mobile",
      "width": 390,
      "height": 844
    },
    {
      "name": "desktop",
      "width": 1280,
      "height": 800
    }
  ],
  "stylesheets": []
}
